<?xml version="1.0" encoding="UTF-8"?>
<healthData xmlns:xsi="http://www.w3.org/2001/XMLSchema-instance"
            xsi:noNamespaceSchemaLocation="schema.xsd"
            lang="cs">
  <institution id="ins001">
    <name>Centrum Zdraví</name>
    <address>
      <street>Nemocniční 1</street>
      <city>Praha 9</city>
      <postalCode>19000</postalCode>
      <country>Česká Republika</country>
    </address>
    <openingHours>
      <weekday from="08:00:00" to="18:00:00">Pondělí-Pátek</weekday>
      <weekend from="09:00:00" to="14:00:00">Sobota</weekend>
    </openingHours>
    <social>
      <facebook url="https://facebook.com/centrumzdravi"/>
      <twitter url="https://twitter.com/centrumzdravi"/>
      <instagram url="https://instagram.com/centrumzdravi"/>
      <threads url="https://threads.com/centrumzdravi" />
    </social>
    <services>
      <!-- Existing Service -->
      <service id="ser001" appointment="required">
        <title>Obecná prohlídka</title>
        <description>Komplexní zdravotní prohlídka s krevními testy a konzultací.</description>
        <details>
          <duration unit="minutes">30</duration>
          <price currency="CZK">500.00</price>
          <staff>
            <doctor id="doc001" languages="cs en">
              <name>MUDr. Jan Novák</name>
              <specialty>Všeobecná medicína</specialty>
            </doctor>
          </staff>
        </details>
      </service>

      <service id="ser002" appointment="optional">
        <title>Dětská péče</title>
        <description>Preventivní prohlídky a očkování pro děti do 15 let</description>
        <details>
          <duration unit="minutes">45</duration>
          <price currency="CZK">700.00</price>
          <staff>
            <doctor id="doc002" languages="cs en de">
              <name>MUDr. Eva Svobodová</name>
              <specialty>Pediatrie</specialty>
            </doctor>
          </staff>
        </details>
      </service>

      <service id="ser003" appointment="walk-in">
        <title>Zubní ordinace</title>
        <description>Preventivní prohlídky a základní stomatologické výkony</description>
        <details>
          <duration unit="minutes">60</duration>
          <price currency="CZK">1200.00</price>
          <staff>
            <doctor id="doc003" languages="cs sk">
              <name>MDDr. Petr Horák</name>
              <specialty>Stomatologie</specialty>
            </doctor>
          </staff>
        </details>
      </service>

      <service id="ser004" appointment="required">
        <title>Dermatologie</title>
        <description>Diagnostika a léčba kožních onemocnění</description>
        <details>
          <duration unit="minutes">40</duration>
          <price currency="CZK">900.00</price>
          <staff>
            <doctor id="doc004" languages="cs en fr">
              <name>MUDr. Anna Černá</name>
              <specialty>Dermatologie</specialty>
            </doctor>
          </staff>
        </details>
      </service>
    </services>

    <news>
      <article id="art001" importance="important">
        <title>Nová služba v centru</title>
        <content>Centrum Zdraví rozšiřuje své služby o fyzioterapii.</content>
        <date>2025-02-10</date>
      </article>

      <article id="art002" importance="regular">
        <title>Nové vybavení</title>
        <content>Pořídili jsme nový ultrazvukový přístroj nejnovější generace.</content>
        <date>2025-03-01</date>
      </article>

      <article id="art003" importance="important">
        <title>Letní ordinační hodiny</title>
        <content>Od 1.7. do 31.8. máme prodloužené ordinační hodiny.</content>
        <date>2025-06-15</date>
      </article>

      <article id="art004" importance="regular">
        <title>Workshop zdravého životního stylu</title>
        <content>Přijďte na náš bezplatný workshop o výživě a pohybu.</content>
        <date>2025-04-20</date>
      </article>
    </news>
  </institution>
</healthData>